{"id":"fx_medium_chain","schemaVersion":1,"title":"A 40-node chain","type":"architecture","nodes":[{"id":"n_0","kind":"service","label":"Node 0 (agent edit 1)","shape":"rounded","geometry":{"x":40,"y":40,"w":160,"h":80}},{"id":"n_1","kind":"database","label":"Node 1","shape":"cylinder","geometry":{"x":240,"y":40,"w":160,"h":80}},{"id":"n_2","kind":"queue","label":"Node 2","shape":"rounded","geometry":{"x":440,"y":40,"w":160,"h":80}},{"id":"n_3","kind":"service","label":"Node 3","shape":"rounded","geometry":{"x":640,"y":40,"w":160,"h":80}},{"id":"n_4","kind":"database","label":"Node 4","shape":"cylinder","geometry":{"x":840,"y":40,"w":160,"h":80}},{"id":"n_5","kind":"queue","label":"Node 5","shape":"rounded","geometry":{"x":1040,"y":40,"w":160,"h":80}},{"id":"n_6","kind":"service","label":"Node 6","shape":"rounded","geometry":{"x":1240,"y":40,"w":160,"h":80}},{"id":"n_7","kind":"database","label":"Node 7","shape":"cylinder","geometry":{"x":1440,"y":40,"w":160,"h":80}},{"id":"n_8","kind":"queue","label":"Node 8","shape":"rounded","geometry":{"x":40,"y":160,"w":160,"h":80}},{"id":"n_9","kind":"service","label":"Node 9","shape":"rounded","geometry":{"x":240,"y":160,"w":160,"h":80}},{"id":"n_10","kind":"database","label":"Node 10","shape":"cylinder","geometry":{"x":440,"y":160,"w":160,"h":80}},{"id":"n_11","kind":"queue","label":"Node 11","shape":"rounded","geometry":{"x":640,"y":160,"w":160,"h":80}},{"id":"n_12","kind":"service","label":"Node 12","shape":"rounded","geometry":{"x":840,"y":160,"w":160,"h":80}},{"id":"n_13","kind":"database","label":"Node 13","shape":"cylinder","geometry":{"x":1040,"y":160,"w":160,"h":80}},{"id":"n_14","kind":"queue","label":"Node 14","shape":"rounded","geometry":{"x":1240,"y":160,"w":160,"h":80}},{"id":"n_15","kind":"service","label":"Node 15","shape":"rounded","geometry":{"x":1440,"y":160,"w":160,"h":80}},{"id":"n_16","kind":"database","label":"Node 16","shape":"cylinder","geometry":{"x":40,"y":280,"w":160,"h":80}},{"id":"n_17","kind":"queue","label":"Node 17","shape":"rounded","geometry":{"x":240,"y":280,"w":160,"h":80}},{"id":"n_18","kind":"service","label":"Node 18","shape":"rounded","geometry":{"x":440,"y":280,"w":160,"h":80}},{"id":"n_19","kind":"database","label":"Node 19","shape":"cylinder","geometry":{"x":640,"y":280,"w":160,"h":80}},{"id":"n_20","kind":"queue","label":"Node 20","shape":"rounded","geometry":{"x":840,"y":280,"w":160,"h":80}},{"id":"n_21","kind":"service","label":"Node 21","shape":"rounded","geometry":{"x":1040,"y":280,"w":160,"h":80}},{"id":"n_22","kind":"database","label":"Node 22","shape":"cylinder","geometry":{"x":1240,"y":280,"w":160,"h":80}},{"id":"n_23","kind":"queue","label":"Node 23","shape":"rounded","geometry":{"x":1440,"y":280,"w":160,"h":80}},{"id":"n_24","kind":"service","label":"Node 24","shape":"rounded","geometry":{"x":40,"y":400,"w":160,"h":80}},{"id":"n_25","kind":"database","label":"Node 25","shape":"cylinder","geometry":{"x":240,"y":400,"w":160,"h":80}},{"id":"n_26","kind":"queue","label":"Node 26","shape":"rounded","geometry":{"x":440,"y":400,"w":160,"h":80}},{"id":"n_27","kind":"service","label":"Node 27","shape":"rounded","geometry":{"x":640,"y":400,"w":160,"h":80}},{"id":"n_28","kind":"database","label":"Node 28","shape":"cylinder","geometry":{"x":840,"y":400,"w":160,"h":80}},{"id":"n_29","kind":"queue","label":"Node 29","shape":"rounded","geometry":{"x":1040,"y":400,"w":160,"h":80}},{"id":"n_30","kind":"service","label":"Node 30","shape":"rounded","geometry":{"x":1240,"y":400,"w":160,"h":80}},{"id":"n_31","kind":"database","label":"Node 31","shape":"cylinder","geometry":{"x":1440,"y":400,"w":160,"h":80}},{"id":"n_32","kind":"queue","label":"Node 32","shape":"rounded","geometry":{"x":40,"y":520,"w":160,"h":80}},{"id":"n_33","kind":"service","label":"Node 33","shape":"rounded","geometry":{"x":240,"y":520,"w":160,"h":80}},{"id":"n_34","kind":"database","label":"Node 34","shape":"cylinder","geometry":{"x":440,"y":520,"w":160,"h":80}},{"id":"n_35","kind":"queue","label":"Node 35","shape":"rounded","geometry":{"x":640,"y":520,"w":160,"h":80}},{"id":"n_36","kind":"service","label":"Node 36","shape":"rounded","geometry":{"x":840,"y":520,"w":160,"h":80}},{"id":"n_37","kind":"database","label":"Node 37","shape":"cylinder","geometry":{"x":1040,"y":520,"w":160,"h":80}},{"id":"n_38","kind":"queue","label":"Node 38","shape":"rounded","geometry":{"x":1240,"y":520,"w":160,"h":80}},{"id":"n_39","kind":"service","label":"Node 39","shape":"rounded","geometry":{"x":1440,"y":520,"w":160,"h":80}}],"edges":[{"id":"e_1","kind":"flow","from":{"node":"n_0"},"to":{"node":"n_1"}},{"id":"e_2","kind":"flow","from":{"node":"n_1"},"to":{"node":"n_2"}},{"id":"e_3","kind":"flow","from":{"node":"n_2"},"to":{"node":"n_3"}},{"id":"e_4","kind":"flow","from":{"node":"n_3"},"to":{"node":"n_4"}},{"id":"e_5","kind":"flow","from":{"node":"n_4"},"to":{"node":"n_5"}},{"id":"e_6","kind":"flow","from":{"node":"n_5"},"to":{"node":"n_6"}},{"id":"e_7","kind":"flow","from":{"node":"n_6"},"to":{"node":"n_7"}},{"id":"e_8","kind":"flow","from":{"node":"n_7"},"to":{"node":"n_8"}},{"id":"e_9","kind":"flow","from":{"node":"n_8"},"to":{"node":"n_9"}},{"id":"e_10","kind":"flow","from":{"node":"n_9"},"to":{"node":"n_10"}},{"id":"e_11","kind":"flow","from":{"node":"n_10"},"to":{"node":"n_11"}},{"id":"e_12","kind":"flow","from":{"node":"n_11"},"to":{"node":"n_12"}},{"id":"e_13","kind":"flow","from":{"node":"n_12"},"to":{"node":"n_13"}},{"id":"e_14","kind":"flow","from":{"node":"n_13"},"to":{"node":"n_14"}},{"id":"e_15","kind":"flow","from":{"node":"n_14"},"to":{"node":"n_15"}},{"id":"e_16","kind":"flow","from":{"node":"n_15"},"to":{"node":"n_16"}},{"id":"e_17","kind":"flow","from":{"node":"n_16"},"to":{"node":"n_17"}},{"id":"e_18","kind":"flow","from":{"node":"n_17"},"to":{"node":"n_18"}},{"id":"e_19","kind":"flow","from":{"node":"n_18"},"to":{"node":"n_19"}},{"id":"e_20","kind":"flow","from":{"node":"n_19"},"to":{"node":"n_20"}},{"id":"e_21","kind":"flow","from":{"node":"n_20"},"to":{"node":"n_21"}},{"id":"e_22","kind":"flow","from":{"node":"n_21"},"to":{"node":"n_22"}},{"id":"e_23","kind":"flow","from":{"node":"n_22"},"to":{"node":"n_23"}},{"id":"e_24","kind":"flow","from":{"node":"n_23"},"to":{"node":"n_24"}},{"id":"e_25","kind":"flow","from":{"node":"n_24"},"to":{"node":"n_25"}},{"id":"e_26","kind":"flow","from":{"node":"n_25"},"to":{"node":"n_26"}},{"id":"e_27","kind":"flow","from":{"node":"n_26"},"to":{"node":"n_27"}},{"id":"e_28","kind":"flow","from":{"node":"n_27"},"to":{"node":"n_28"}},{"id":"e_29","kind":"flow","from":{"node":"n_28"},"to":{"node":"n_29"}},{"id":"e_30","kind":"flow","from":{"node":"n_29"},"to":{"node":"n_30"}},{"id":"e_31","kind":"flow","from":{"node":"n_30"},"to":{"node":"n_31"}},{"id":"e_32","kind":"flow","from":{"node":"n_31"},"to":{"node":"n_32"}},{"id":"e_33","kind":"flow","from":{"node":"n_32"},"to":{"node":"n_33"}},{"id":"e_34","kind":"flow","from":{"node":"n_33"},"to":{"node":"n_34"}},{"id":"e_35","kind":"flow","from":{"node":"n_34"},"to":{"node":"n_35"}},{"id":"e_36","kind":"flow","from":{"node":"n_35"},"to":{"node":"n_36"}},{"id":"e_37","kind":"flow","from":{"node":"n_36"},"to":{"node":"n_37"}},{"id":"e_38","kind":"flow","from":{"node":"n_37"},"to":{"node":"n_38"}},{"id":"e_39","kind":"flow","from":{"node":"n_38"},"to":{"node":"n_39"}}],"meta":{"createdAt":"2026-10-01T13:03:19.932Z","updatedAt":"2026-10-01T13:03:19.996Z","createdBy":"user:Fixture Admin (throwaway)"}}