{"id":"fx_image_node","schemaVersion":1,"title":"A diagram with an uploaded image","type":"freeform","nodes":[{"id":"n_img","kind":"image","label":"Pixel","shape":"image","geometry":{"x":0,"y":0,"w":96,"h":96},"props":{"assetId":"asset_43f2d419571f"}}],"edges":[],"meta":{"createdAt":"2026-10-01T13:00:39.062Z","updatedAt":"2026-10-01T13:00:39.062Z","createdBy":"user:Fixture Admin (throwaway)"}}