{"id":"fx_flythrough","schemaVersion":1,"title":"Order flow with a tour","type":"architecture","nodes":[{"id":"n_web","kind":"service","label":"Web","shape":"rounded","geometry":{"x":0,"y":0,"w":160,"h":80}},{"id":"n_api","kind":"service","label":"API","shape":"rounded","geometry":{"x":260,"y":0,"w":160,"h":80}},{"id":"n_db","kind":"database","label":"Database","shape":"cylinder","geometry":{"x":520,"y":0,"w":160,"h":80}}],"edges":[{"id":"e_1","kind":"flow","from":{"node":"n_web"},"to":{"node":"n_api"}},{"id":"e_2","kind":"data","from":{"node":"n_api"},"to":{"node":"n_db"}}],"meta":{"createdAt":"2026-10-01T13:03:19.938Z","updatedAt":"2026-10-01T13:03:19.938Z","createdBy":"user:Fixture Admin (throwaway)"},"flythrough":{"keyframes":[{"id":"k_1","view":{"x":-40,"y":-40,"w":760,"h":200},"caption":"The whole path"},{"id":"k_2","view":{"x":0,"y":0,"w":200,"h":100},"caption":"Traffic enters here","durationMs":1600,"holdMs":3000,"easing":"easeOut"},{"id":"k_3","view":{"x":480,"y":0,"w":240,"h":100},"caption":"and lands in the database","durationMs":1800}],"loop":true}}