{
  "id": "doc_order_service",
  "schemaVersion": 1,
  "title": "Order service",
  "type": "architecture",
  "nodes": [
    {
      "id": "n_web",
      "kind": "service",
      "label": "Web app",
      "shape": "rounded",
      "geometry": { "x": 40, "y": 40, "w": 320, "h": 80 }
    },
    {
      "id": "c_vpc",
      "kind": "container",
      "label": "VPC",
      "shape": "rectangle",
      "geometry": { "x": 16, "y": 168, "w": 568, "h": 300 },
      "style": { "dash": "dashed" }
    },
    {
      "id": "n_api",
      "kind": "service",
      "label": "Orders API",
      "shape": "rounded",
      "geometry": { "x": 40, "y": 200, "w": 320, "h": 80 },
      "props": { "owner": "platform" },
      "parent": "c_vpc",
      "ports": [
        { "id": "in", "x": 0.5, "y": 0 },
        { "id": "db", "x": 0.25, "y": 1 },
        { "id": "cache", "x": 1, "y": 0.5 }
      ]
    },
    {
      "id": "n_db",
      "kind": "database",
      "label": "Postgres",
      "shape": "cylinder",
      "geometry": { "x": 40, "y": 360, "w": 160, "h": 80 },
      "parent": "c_vpc"
    },
    {
      "id": "n_cache",
      "kind": "queue",
      "label": "Redis",
      "shape": "rectangle",
      "geometry": { "x": 400, "y": 360, "w": 160, "h": 80 },
      "parent": "c_vpc"
    }
  ],
  "edges": [
    {
      "id": "e_1",
      "kind": "flow",
      "label": "HTTPS",
      "from": { "node": "n_web" },
      "to": { "node": "n_api", "port": "in" },
      "routing": { "mode": "orthogonal" }
    },
    {
      "id": "e_2",
      "kind": "data",
      "label": "read/write",
      "from": { "node": "n_api", "port": "db" },
      "to": { "node": "n_db" },
      "routing": { "mode": "orthogonal" },
      "style": { "arrowStart": "arrow", "arrowEnd": "arrow" }
    },
    {
      "id": "e_3",
      "kind": "data",
      "from": { "node": "n_api", "port": "cache" },
      "to": { "node": "n_cache" },
      "routing": {
        "mode": "orthogonal",
        "waypoints": [{ "x": 480, "y": 240 }]
      }
    }
  ],
  "meta": {
    "createdAt": "2026-09-20T22:00:00.000Z",
    "updatedAt": "2026-09-20T22:05:00.000Z",
    "createdBy": "eric",
    "aiProvenance": [
      {
        "agent": "claude-code",
        "model": "claude-fable-5-1",
        "at": "2026-09-20T22:05:00.000Z",
        "action": "updated",
        "elementIds": ["n_cache", "e_3"]
      }
    ]
  },
  "flythrough": {
    "keyframes": [
      {
        "id": "k_overview",
        "view": { "x": -40, "y": 8, "w": 680, "h": 500 },
        "caption": "Order service: a web app, an API, a database and a cache"
      },
      {
        "id": "k_web",
        "view": { "x": 0, "y": 0, "w": 400, "h": 250 },
        "caption": "Traffic enters through the web app over HTTPS",
        "durationMs": 1600
      },
      {
        "id": "k_vpc",
        "view": { "x": -16, "y": 136, "w": 632, "h": 364 },
        "caption": "Everything else sits inside the VPC",
        "holdMs": 3000
      },
      {
        "id": "k_data",
        "view": { "x": 16, "y": 320, "w": 568, "h": 160 },
        "caption": "Postgres holds the orders; Redis is the cache",
        "durationMs": 1800,
        "easing": "easeOut"
      }
    ],
    "loop": true
  }
}
