{"id":"fx_unicode","schemaVersion":1,"title":"Unicode & quoting: café ☕ 日本語 العربية \"quoted\" <angle> & ampersand","type":"freeform","nodes":[{"id":"n_cafe","kind":"box","label":"Café ☕ — naïve résumé","shape":"rounded","geometry":{"x":0,"y":0,"w":200,"h":80}},{"id":"n_jp","kind":"box","label":"日本語のラベル","shape":"rectangle","geometry":{"x":260,"y":0,"w":200,"h":80}},{"id":"n_ar","kind":"box","label":"مرحبا بالعالم","shape":"rectangle","geometry":{"x":520,"y":0,"w":200,"h":80}},{"id":"n_quote","kind":"box","label":"He said \"hello\" & <left>\\back","shape":"rectangle","geometry":{"x":0,"y":140,"w":240,"h":80}},{"id":"n_emoji","kind":"box","label":"\uD83D\uDE80 emoji \uD83D\uDC69‍\uD83D\uDCBB ZWJ","shape":"pill","geometry":{"x":300,"y":140,"w":240,"h":80}}],"edges":[{"id":"e_u1","kind":"flow","label":"élan → 速い","from":{"node":"n_cafe"},"to":{"node":"n_jp"}}],"meta":{"createdAt":"2026-10-01T13:03:19.928Z","updatedAt":"2026-10-01T13:03:19.928Z","createdBy":"user:Fixture Admin (throwaway)"}}